<?xml version="1.0" encoding="UTF-8"?>
<LocalConfiguration xmlns:xsi="http://www.w3.org/2001/XMLSchema-instance"
                         xsi:noNamespaceSchemaLocation="LocalConfiguration.xsd">

    <InstanceName>TEST001</InstanceName>

    <DatabaseConnections>
        <DatabaseConnection>
            <DatabaseType>sftpreader</DatabaseType>
            <Hostname>localhost</Hostname>
            <Port>5432</Port>
            <Database>sftpreader</Database>
            <Username>postgres</Username>
            <Password></Password>
        </DatabaseConnection>
        <DatabaseConnection>
            <DatabaseType>hl7receiver</DatabaseType>
            <Hostname>localhost</Hostname>
            <Port>5432</Port>
            <Database>hl7receiver</Database>
            <Username>postgres</Username>
            <Password></Password>
        </DatabaseConnection>
    </DatabaseConnections>

</LocalConfiguration>